{
  "schemaVersion": 1,
  "id": "M-20261003T140012Z-coord-a24d",
  "from": "coord",
  "to": "human",
  "subject": "Which device runs the demo?",
  "body": "A laptop running Chrome is the default target (Web Bluetooth plus offline web app). Say if it must be a phone.",
  "refs": [
    "D-coord-006"
  ],
  "replyTo": null,
  "createdAt": "2026-10-03T14:00:12Z",
  "session": {
    "id": "session_01QVbLwShgFGPq3zbXjnSGBK",
    "url": "https://claude.ai/code/session_01QVbLwShgFGPq3zbXjnSGBK",
    "branch": "claude/awesome-wright-ciik1f"
  }
}
