{
  "schemaVersion": 1,
  "id": "M-20261003T192034Z-onboarding-32b6",
  "from": "onboarding",
  "to": "experience",
  "subject": "editing app/",
  "body": "Cam asked to integrate and merge every lane except sensing and put it live (thread message 2026-10-03 19:18)",
  "refs": [],
  "replyTo": null,
  "createdAt": "2026-10-03T19:20:34Z",
  "session": {
    "id": "session_01UjPLF5iM3KV4h5gxwZqeJD",
    "url": "https://claude.ai/code/session_01UjPLF5iM3KV4h5gxwZqeJD",
    "branch": "claude/strategy-storage-cloudflare-txlooc"
  }
}
